{
  "@context": "https://concert.foundation/signet/v0.1/context.jsonld",
  "type": "CoverageAssessment",
  "id": {
    "scheme": "did",
    "id": "did:web:buyer.example#assess-de-2027-t1"
  },
  "market": "DE",
  "deliveryPeriod": {
    "year": 2027,
    "basis": "fiscalYear"
  },
  "portfolioScope": "core",
  "assessedAt": "2026-07-01T06:00:00Z",
  "volumes": {
    "hedged": {
      "amount": 100300,
      "unit": "MWh"
    },
    "floating": {
      "amount": 99700,
      "unit": "MWh"
    },
    "markToMarket": {
      "amount": 200000,
      "unit": "MWh"
    }
  },
  "weightedPrices": {
    "hedged": {
      "amount": 96.4,
      "currency": "EUR",
      "unit": "MWh"
    },
    "floating": {
      "amount": 82.3,
      "currency": "EUR",
      "unit": "MWh"
    }
  },
  "hedgedRatio": 0.5015,
  "policyEvaluation": {
    "policyId": {
      "scheme": "did",
      "id": "did:web:buyer.example#policy-corridor-power"
    },
    "corridorApplied": {
      "minimum": 0.6,
      "target": 0.75,
      "maximum": 0.85
    },
    "status": "belowMinimum",
    "distanceToMinimum": 0.0985
  },
  "reconciliation": {
    "status": "reconciled",
    "rule": "hedged + floating = markToMarket",
    "tolerance": 0
  },
  "positions": [
    {
      "scheme": "did",
      "id": "did:web:buyer.example#pos-de-2027-hedged-0042"
    },
    {
      "scheme": "did",
      "id": "did:web:buyer.example#pos-de-2027-floating-0043"
    },
    {
      "scheme": "did",
      "id": "did:web:buyer.example#pos-de-2027-mtm-0044"
    }
  ],
  "provenance": {
    "generatedBy": {
      "scheme": "did",
      "id": "did:web:buyer.example#risk-agent-1"
    },
    "generatedAt": "2026-07-01T06:00:00Z"
  }
}
